id,event_name,event_description,event_start,event_length,event_location,event_owner,creation_time,last_edited
1,stabilis sopor thermae acer sono labore,Tener ventus spiritus dignissimos damnatio thesis. Bardus casus usus tabesco. Conculco capillus caries dolorem labore molestias bos approbo tempus nesciunt. Tempus thesaurus capio stillicidium ago abbas abundans iste clibanus vomica. Compello altus turpis tero advenio subnecto. Vilitas inflammatio deputo tonsor despecto uter aegre cibo.,2024-02-04 13:30:00,120,1531 N High Street,3,1705462404576,1705462404576
2,torrens cum denego cuius theca aureus corrumpo,Caries solus facere. Peior subvenio theologus ambitus. Fugiat utor tamdiu altus degusto trepide aeger. Absconditus eligendi enim vito arma carbo. Catena aurum aegrus aliquid vitium tunc copiose in tendo utor. Tolero error voluptatibus laudantium adfero commodo acsi vox convoco doloremque.,2024-03-18 11:30:00,90,97229 Sycamore Avenue,9,1705462795710,1705462795710
3,traho coniecto coaegresco charisma vicinus testimonium testimonium,Viduo curtus et venio cognatus decipio. Admitto beatae ipsum vaco accusator tempora aspicio expedita verecundia bonus.,2024-03-08 12:00:00,30,8138 Mekhi Motorway,4,1706189042507,1706189042507
4,derelinquo volubilis tenus vigilo,Constans nesciunt solum dolorem. Clibanus tergiversatio tres antepono optio articulus auditor tero. Patria sint libero currus vorago.,2024-03-28 14:00:00,30,83487 Diana Pike,7,1704654001270,1704654001270
5,repellat cresco vestigium denuo,Derelinquo impedit ascisco uterque. Sumptus cenaculum confero cohibeo confugo angelus crebro comitatus. Capio ante celebrer despecto inflammatio benigne debeo stips cado porro. Deduco uxor damnatio ambitus.,2024-04-04 14:30:00,30,82541 Gertrude Points,2,1706640813290,1706640813290
6,crinis quas astrum comptus cohors cetera,Defendo tabgo averto carbo. Delicate vigor volva vorago tamen demo cognomen. Vae depromo labore veritas odio. Conqueror antea tremo artificiose cognomen suffragium. Arbitro coma abscido conor accedo ultra quidem crastinus. Velit blanditiis sponte mollitia ullam caecus exercitationem strues denego patior.,2024-03-29 11:00:00,60,9234 Edna Camp,2,1708058694578,1708058694578
7,studio tyrannus custodia taceo sum,Utique delibero caveo ullam clementia vehemens communis deleo desparatus. Impedit collum vetus.,2024-04-05 14:00:00,60,951 Chapel Close,8,1707884705388,1707884705388
8,conitor copia adflicto cultellus comprehendo,Stultus verto tantum velit. Utroque sumo administratio ara venustas combibo toties surculus degusto.,2024-03-24 10:00:00,120,6594 Lind Ferry,2,1708163009388,1708163009388
9,suggero cultura conicio turba reprehenderit dedico sui,Comes optio apud abscido caelum exercitationem vaco. Sustineo necessitatibus truculenter verto argentum. Cur speciosus similique. Tres viduo in. Tendo tempus adduco clamo cursus attonbitus defungo collum.,2024-04-16 15:00:00,120,116 1st Avenue,5,1707746853728,1707746853728
10,cavus textilis illum cuius labore sublime,Caveo aptus thesis vesco conqueror. Amiculum victoria clarus vere conculco curiositas cicuta turba celebrer placeat. Solutio anser vinum surculus. Territo cribro coerceo calcar despecto ambulo odit. Accusator caveo confido utique. Termes vinum auditor cerno vis.,2024-02-02 13:00:00,90,775 Church Walk,1,1705647902444,1705647902444
11,clibanus at pel aequus advoco,Creo caries thermae adimpleo cicuta voro stips alius casus. Sumo candidus excepturi advenio cubitum adsuesco. Laudantium somniculosus templum adeo constans amoveo uberrime collum apud coniuratio.,2024-02-19 11:30:00,60,9370 Cleveland Street,8,1707876732371,1707876732371
12,ulciscor convoco decretum,Clam temperantia sumo comburo dolorem accendo beatus colo. Solio voluptates pectus ver vulgaris. Callide aequitas synagoga ultio solvo aer tres.,2024-02-17 13:00:00,120,7539 Louie Drives,6,1704388474261,1704388474261
13,spes infit tepesco at cohibeo appello decumbo,Clarus adulescens tepidus barba cubitum solio crux. Viduo ducimus absque convoco vicissitudo. Turpis decor patruus. Delicate sol alias delectatio.,2024-04-22 11:30:00,120,7785 Princes Street,9,1707590484460,1707590484460
14,amplexus cur xiphias universe ad clementia tertius,Eum thesis aegrotatio taceo natus perspiciatis abbas reprehenderit neque ascisco. Strues denuo compono advoco. Vulgivagus ager vitiosus acquiro virga quam adfero fuga.,2024-02-20 13:30:00,30,7373 Hector Plains,4,1706523814029,1706523814029
15,saepe adhaero auctus aestus similique ager spero,Strenuus decretum conor at amplitudo neque vespillo. Cornu adsuesco dolores claro dicta audentia summisse turbo tergiversatio atqui. Tenuis super calamitas decimus corrigo paulatim. Dignissimos communis conor tenus civitas caritas stipes. Deduco denique quo conatus teres coma annus turbo eos. Ex supplanto vitae vereor provident.,2024-03-24 11:00:00,60,71923 N Railroad Street,9,1705722281145,1705722281145
